{
   "version": "1.1.0",
   "$schema": "./abi.schema.json",
   "description": "thoth-ipc cross-language ABI — language-neutral source of truth. Structurally validated by abi.schema.json; semantically validated against the deployed C++ by abi/dump_abi.cpp via the `tools/abi` Rust checker; behaviourally validated by the xlang matrix. This is an initial slice (ring layouts + core constants); extend it as the codegen adopts more of the surface.",
   "targets": {
      "apple_arm64": {
         "align_size": 8,
         "shm_name_max": 31,
         "description": "macOS arm64 — the implemented target; AlignSize = min(64, alignof(max_align_t)) = 8; PSHMNAMLEN = 31"
      },
      "x86_64": {
         "align_size": 16,
         "shm_name_max": 0,
         "description": "x86-64 / Linux aarch64 — AlignSize = 16; shm_name_max = 0 (no shortening off macOS)"
      }
   },
   "constants": [
      {
         "name": "data_length",
         "type": "usize",
         "value": 64,
         "description": "msg_t payload fragment size (large_msg_limit)"
      },
      {
         "name": "ring_size",
         "type": "usize",
         "value": 256,
         "description": "ring slot count (block_[256])"
      },
      {
         "name": "large_msg_align",
         "type": "usize",
         "value": 1024,
         "description": "chunk-size alignment"
      },
      {
         "name": "large_msg_cache",
         "type": "usize",
         "value": 32,
         "description": "chunk slots per chunk size (id_pool capacity)"
      },
      {
         "name": "chunk_header_size",
         "type": "usize",
         "value": {
            "apple_arm64": 8,
            "x86_64": 16
         },
         "description": "per-chunk header = make_align(alignof(max_align_t), sizeof(atomic<cc_t>)=4); align-dependent"
      },
      {
         "name": "route_ep_mask",
         "type": "u64",
         "value": "0x00000000ffffffff",
         "description": "route rc_: low 32 = connection bitmask"
      },
      {
         "name": "route_ep_incr",
         "type": "u64",
         "value": "0x0000000100000000",
         "description": "route rc_: epoch increment (high 32)"
      },
      {
         "name": "chan_rc_mask",
         "type": "u64",
         "value": "0x00000000ffffffff",
         "description": "channel rc_: low 32 = per-reader bitmask"
      },
      {
         "name": "chan_ep_mask",
         "type": "u64",
         "value": "0x00ffffffffffffff",
         "description": "channel rc_: low 56 = rc bits + internal read-gen"
      },
      {
         "name": "chan_ep_incr",
         "type": "u64",
         "value": "0x0100000000000000",
         "description": "channel rc_: epoch increment (top byte)"
      },
      {
         "name": "chan_ic_mask",
         "type": "u64",
         "value": "0xff000000ffffffff",
         "description": "channel rc_: invert-carry mask"
      },
      {
         "name": "chan_ic_incr",
         "type": "u64",
         "value": "0x0000000100000000",
         "description": "channel rc_: internal read-generation increment (bits 32..)"
      },
      {
         "name": "syncabi_magic",
         "type": "u32",
         "value": 1279873857,
         "description": "SyncAbi stamp magic \"LISA\" (0x4C495341)"
      },
      {
         "name": "syncabi_backend_posix_pthread",
         "type": "u32",
         "value": 1,
         "description": "SyncAbi backend id: posix_pthread (pthread_mutex_t / pthread_cond_t; FreeBSD, QNX and other POSIX)"
      },
      {
         "name": "syncabi_backend_ulock",
         "type": "u32",
         "value": 2,
         "description": "SyncAbi backend id: apple_ulock"
      },
      {
         "name": "syncabi_backend_apple_mach",
         "type": "u32",
         "value": 3,
         "description": "SyncAbi backend id: apple_mach (App-Store-safe macOS profile; C++ only)"
      },
      {
         "name": "syncabi_backend_win32",
         "type": "u32",
         "value": 4,
         "description": "SyncAbi backend id: win32 (named kernel objects, payload size 0)"
      },
      {
         "name": "syncabi_backend_linux_a0",
         "type": "u32",
         "value": 5,
         "description": "SyncAbi backend id: linux_a0 (vendored alephzero robust PI futex mutex a0_mtx_t + condition a0_cnd_t; Linux and Android)"
      },
      {
         "name": "sipc_magic",
         "type": "string",
         "value": "SIPC",
         "description": "secure envelope v1 magic"
      },
      {
         "name": "sipc_version",
         "type": "u8",
         "value": 1,
         "description": "secure envelope v1 version"
      },
      {
         "name": "notify_hash_xchan",
         "type": "string",
         "value": "098e889ce378ae04",
         "description": "golden fnv1a_64(\"__THOTH_SHM__NOTIFY__xchan\") for (prefix=\"\", name=\"xchan\")"
      },
      {
         "name": "sync_abi_suffix_mutex",
         "type": "string",
         "value": "__thoth_ipc_sync_abi_mutex",
         "description": "cross-process sync sidecar shm-name suffix for a mutex; full name = <channel-name> + this suffix (byte-exact across all ports)"
      },
      {
         "name": "sync_abi_suffix_condition",
         "type": "string",
         "value": "__thoth_ipc_sync_abi_condition",
         "description": "cross-process sync sidecar shm-name suffix for a condition variable; full name = <channel-name> + this suffix (byte-exact across all ports)"
      }
   ],
   "enums": [
      {
         "name": "codec_id",
         "type": "u32",
         "description": "typed codec ids",
         "values": [
            {
               "name": "flatbuffers",
               "value": 1
            },
            {
               "name": "protobuf",
               "value": 2
            },
            {
               "name": "capnp",
               "value": 3
            }
         ]
      },
      {
         "name": "secure_alg",
         "type": "u16",
         "description": "AEAD algorithm ids (SIPC envelope)",
         "values": [
            {
               "name": "aes256gcm",
               "value": 1
            },
            {
               "name": "chacha20poly1305",
               "value": 2
            }
         ]
      }
   ],
   "structs": [
      {
         "name": "msg_t",
         "size": 80,
         "align": 8,
         "description": "message framing inside a slot's data_ (msg_t<64,8>)",
         "fields": [
            {
               "name": "cc_id",
               "offset": 0,
               "type": "u32",
               "description": "sender identity (self-message filter)"
            },
            {
               "name": "id",
               "offset": 4,
               "type": "u32",
               "description": "message id (fragments share it)"
            },
            {
               "name": "remain",
               "offset": 8,
               "type": "i32",
               "description": "bytes remaining after this fragment"
            },
            {
               "name": "storage",
               "offset": 12,
               "type": "u8",
               "description": "payload is a storage_id (large-message path)"
            },
            {
               "name": "payload",
               "offset": 16,
               "type": "bytes",
               "count": 64,
               "description": "payload fragment or storage_id"
            }
         ]
      },
      {
         "name": "ring_header",
         "size": 192,
         "align": 64,
         "description": "shared conn_head_base + cache-line-aligned prod_cons head; identical offsets for route and channel (block_ starts at size)",
         "fields": [
            {
               "name": "cc",
               "offset": 0,
               "type": "u32",
               "atomic": true,
               "description": "connection bitmask"
            },
            {
               "name": "lc",
               "offset": 4,
               "type": "lock",
               "protocol": "spinlock",
               "description": "header lock: thoth::spin_lock = atomic<u32> test-and-set on every target (NOT os_unfair_lock; see context/xlang-channel-abi.md §2), 4 bytes"
            },
            {
               "name": "constructed",
               "offset": 8,
               "type": "u8",
               "atomic": true,
               "description": "DCLP init flag"
            },
            {
               "name": "cursor",
               "offset": 64,
               "type": "u32",
               "atomic": true,
               "description": "route wt_ / channel ct_ (write cursor / commit index)"
            },
            {
               "name": "epoch",
               "offset": 128,
               "type": "u64",
               "description": "writer epoch (atomic on channel, plain on route)"
            }
         ]
      },
      {
         "name": "route_elem",
         "size": {
            "apple_arm64": 88,
            "x86_64": 96
         },
         "align": {
            "apple_arm64": 8,
            "x86_64": 16
         },
         "description": "single-writer route slot (elem_t<80,AlignSize>): `alignas(AlignSize) byte_t data_[80]` + `atomic<u64> rc_`. AlignSize = min(DataSize, alignof(max_align_t)), so the ALIGNMENT is what makes the slot 88 on the align-8 targets and 96 elsewhere; it is per-target for the same reason the size is, and a port that hardcodes 8 gets the stride wrong off Apple/MSVC",
         "fields": [
            {
               "name": "data",
               "offset": 0,
               "type": "bytes",
               "count": 80,
               "description": "holds a msg_t"
            },
            {
               "name": "rc",
               "offset": 80,
               "type": "u64",
               "atomic": true,
               "description": "read-counter (bitmask + epoch)"
            }
         ]
      },
      {
         "name": "channel_elem",
         "size": 96,
         "align": {